"program","willingness_to_pay","government_net_costs","reform_valuation","net_income_increase","program_cost","tax_revenue_increase","education_cost","prices_year","mvpf","bafoeg_valuation","bafoeg_cost","bafoeg_repayment","private_safer_traffic_valuation","utility_loss_helmet","helmet_cost","co2_emission_reducation","private_health_cost","value_added_tax_loss","public_health_cost","public_safer_traffic_valuation","valuation_lower_risk_of_dying","income_loss","earlier_labor_market_participation_net_income","earlier_labor_market_participation_tax_revenue","child_care_cost_reduction","benefit_receipt","tax_revenue_increase_children","cost_increased_travel_time","private_fuel_cost_saving","energy_tax_loss","local_emission_reduction","fiscal_externality","valuation_reduced_risk","government_net_costs_per_program_cost","willingness_to_pay_per_program_cost","fiscal_externality_per_euro","program_name","year","category","average_age_beneficiary","short_description","average_earnings_beneficiary","notes","Papers","Links"
"bafoeg2001",2823.42099751718,1956.42465297564,1964.27608387597,859.144913641216,2010.31380459181,-151.613808289626,97.7246566734571,2001,1.44315345506553,NA,NA,NA,NA,NA,NA,NA,NA,NA,NA,NA,NA,NA,NA,NA,NA,NA,NA,NA,NA,NA,NA,NA,NA,0.973193661858621,1.40446779555915,-0.0268063381413786,"Bafög Refrom 2001",2001,"Education",19.421,"Bafög is a means-tested public German student loan program. Eligible students only have to pay back about 50% of the loan. In 1990, the threshold of parents' income above which students are no longer eligible for Bafög was lowered.",NA,NA,"Baumgartner & Steiner (2006)","https://ideas.repec.org/p/iza/izadps/dp2034.html"
"bafoegRepayment",18914.5072991123,8117.65722132164,NA,10849.0555047366,8065.45179437574,-1914.53920671822,1318.23403382211,1990,2.33004508362733,8065.45179437574,648.51059984201,NA,NA,NA,NA,NA,NA,NA,NA,NA,NA,NA,NA,NA,NA,NA,NA,NA,NA,NA,NA,NA,NA,1.00647272195989,2.34512681760765,0.00647272195989057,"Bafög 50% Repayment Reform",1990,"Education",19.81,"Bafög is a means-tested public German student loan program. Until 1990 students had to repay the entire loan. After the reform about 50% of the loan was offered as a grant which does not have to be payed back.",NA,NA,"Baumgartner & Steiner (2004)","https://ideas.repec.org/p/diw/diwwpp/dp444.html"
"BestUpInformationWorkshop",18404.2415199801,-193.815094569666,NA,17120.0665646622,5.95939086294416,-3021.18821729334,1531.27938567996,2013,Inf,NA,2162.60524379159,-878.430288473767,NA,NA,NA,NA,NA,NA,NA,NA,NA,NA,NA,NA,NA,NA,NA,NA,NA,NA,NA,NA,NA,-32.5226351194414,3088.27562132544,-33.5226351194414,"Best Up College Information Workshop",2013,"Education",19,"A group of researchers  studied the effect of providing information about the benefits of college education to high school students one year prior to graduation.",NA,NA,"Peter et. al. (2018)","https://ideas.repec.org/p/diw/diwwpp/dp1770.html"
"bicycleHelmet",-458544931.437016,-61965044.3939694,NA,NA,NA,NA,NA,2012,7.40005814442123,NA,NA,NA,858065759.718308,-273114492.759317,-324761136.972194,-4885980.35286197,-713849081.070951,-61789274.9742533,53934916.7510162,-54110686.1707322,NA,NA,NA,NA,NA,NA,NA,NA,NA,NA,NA,NA,NA,NA,NA,NA,"Mandatory Bicycle Helmet Law",2012,"Traffic Regulation",NA,"Potential introduction of a law which would mandate that every bicycle rider has to wear a helmet",NA,NA,"Sieg (2014);Elvik (2013)","https://ideas.repec.org/p/mut/wpaper/21.html;https://academic.microsoft.com/paper/2110952839
"
"bridgingAllowance",32051.6269463888,9117.48323348334,NA,32051.6269463888,14773.6526946108,-5656.16946112743,NA,2003,3.5154028941541,NA,NA,NA,NA,NA,NA,NA,NA,NA,NA,NA,NA,NA,NA,NA,NA,NA,NA,NA,NA,NA,NA,NA,NA,0.617144820035554,2.1695126864652,-0.382855179964446,"Bridging Allowance",2003,"Labor Market Policy",40.17,"The bridging allowance ""Überbrückungsgeld"" was a subsidy equal to the potential unemployment benefit payed to start up founders who would otherwise have been eligible for unemployment benefits. The briding allowance was payed for 6 months.",2189.362,NA,"Caliendo & Künn (2011)","https://ideas.repec.org/a/eee/pubeco/v95y2011i3p311-331.html"
"classRoomTraining",5362.79205707321,5286.41591984065,NA,5362.79205707321,6232.79098873592,-946.37506889527,NA,2000,1.01444762167614,NA,NA,NA,NA,NA,NA,NA,NA,NA,NA,NA,NA,NA,NA,NA,NA,NA,NA,NA,NA,NA,NA,NA,NA,0.848161911637084,0.860415834056525,-0.151838088362916,"Class Room Training",2000,"Labor Market Policy",37,"Government sponsored training that lasts on average 7.5 months.",NA,NA,"Biewen et. al. (2014)","https://ideas.repec.org/a/ucp/jlabec/doi10.1086-677233.html"
"coronavirusLockdown",11551.4507004312,-546.958068103465,NA,NA,569.747248891008,-569.747248891008,NA,2019,Inf,NA,NA,NA,NA,NA,NA,NA,NA,NA,NA,NA,14780.018444147,3228.56774371571,NA,NA,NA,NA,NA,NA,NA,NA,NA,NA,NA,-0.960001244706488,20.2746932484812,-1.96000124470649,"Coronavirus Lockdown R=0.6",2020,"Health Program",NA,"Coronavirus induced lockdown with a reproduction number of R=0.627 compared with a hypothetical no lockdown scenario which would have left the GDP unchanged and resulted in 560000 deaths.",NA,NA,"Dorn et. al (2020):Flaxman et al. (2020)","https://ideas.repec.org/a/ces/ifosdd/06.html;https://academic.microsoft.com/paper/3032971139"
"coronavirusLockdownR1",2145.91363843542,-331.891123471498,NA,NA,-296.852500034159,296.852500034159,NA,2019,Inf,NA,NA,NA,NA,NA,NA,NA,NA,NA,NA,NA,463.74947157519,-1682.16416686023,NA,NA,NA,NA,NA,NA,NA,NA,NA,NA,NA,1.11803378254624,-7.22888854966185,0.118033782546238,"Coronavirus Lockdown R=0.6 vs R = 1",2020,"Health Program",NA,"Coronavirus induced lockdown with a reproduction number of R=0.627 compared with a too lash lockdown which would maintained R=1.",NA,NA,"Dorn et. al (2020)","https://ideas.repec.org/a/ces/ifosdd/06.html"
"G8",16245.5235426116,-4793.4649467662,NA,-7772.91644688417,0,1371.69113768544,-1513.57241848526,2011,Inf,NA,NA,NA,NA,NA,NA,NA,NA,NA,NA,NA,NA,NA,24018.4399894958,-4651.58366596639,NA,NA,NA,NA,NA,NA,NA,NA,NA,-Inf,Inf,-Inf,"G8",2011,"Education",18,"Between 2007 and 2013 some German federal states shortened the length of the academic high school track ""Gymnasium"" from 9 to 8 years.",NA,NA,"Marcus & Zambre (2019)","https://ideas.repec.org/a/uwp/jhriss/v54y2019i2p468-502.html"
"homeCareSubsidy",1062.29559903405,593.015227933567,NA,NA,1179.10403627224,138.123502538071,NA,2013,1.79134624035837,NA,NA,NA,NA,NA,NA,NA,NA,NA,NA,NA,NA,NA,NA,NA,724.212310876743,NA,NA,NA,NA,NA,NA,NA,NA,0.502937153712404,0.900934579439252,-0.497062846287596,"Home Care Subsidy",2013,"Familiy Policy",31.36,"The home care subsidy ""Betreuungsgeld"" was introduced in 2013 and was meant to compensate parents who did not make use of subsidised childcare.",NA,NA,"Collischon et al. (2020)","https://ideas.repec.org/p/iza/izadps/dp13271.html"
"jobCreationSchemes",5940.79806507131,18011.0898187942,NA,5940.79806507131,17269.1415313225,-1048.37612913023,NA,2005,0.329841121489063,NA,NA,NA,NA,NA,NA,NA,NA,NA,NA,NA,NA,NA,NA,NA,NA,-306.427841658581,NA,NA,NA,NA,NA,NA,NA,1.04296381995167,0.344012356045376,0.0429638199516704,"Job Creation Schemes",2005,"Labor Market Policy",NA,"Job Creation Schemes ""Arbeitsbeschaffungsmaßnahmen"" are comprised of subsizied jobs aimed at  unemployed who would not be able to find a job otherwise. This measure is mostly employed in local labor markets with excess labor supply. The duration of the subsidy (between 900 and 1300€ payed to the employer) is usually limited to 12 months.",NA,NA,"Hohmeyer & Wolff (2010)","https://ideas.repec.org/p/iab/iabdpa/201021.html"
"jobSearchInformation",131.19642857143,-22.1018907563032,NA,131.19642857143,1.05042016806723,23.1523109243704,NA,2011,Inf,NA,NA,NA,NA,NA,NA,NA,NA,NA,NA,NA,NA,NA,NA,NA,NA,NA,NA,NA,NA,NA,NA,NA,NA,-21.0410000000006,124.899000000001,-22.0410000000006,"Job Search Information Brochure",2011,"Labor Market Policy",36.92,"As part of a randomized field experiment a brochure that informs about the benefits of job search and the consequences of unemployment was sent to newly registered unemployed.",1593.225,NA,"Altmann et al. (2018)","https://ideas.repec.org/a/eee/pubeco/v164y2018icp33-49.html"
"longTraining",28440.7177314119,8791.89821266011,NA,28440.7177314119,13810.8484005563,-5018.95018789621,NA,1993,3.23487795735146,NA,NA,NA,NA,NA,NA,NA,NA,NA,NA,NA,NA,NA,NA,NA,NA,NA,NA,NA,NA,NA,NA,NA,NA,0.636593636948904,2.05930272395621,-0.363406363051096,"Long Training",1993,"Labor Market Policy",35.2,"Government sponsored Training Program lasting longer than 6 months",1396,NA,"Lechner et. al. (2011)","https://ideas.repec.org/a/bla/jeurec/v9y2011i4p742-784.html"
"maternityLeave79",1050.20524912231,2409.55515325851,NA,-287.47207645909,2229.46220930233,129.36257752223,NA,1992,0.435850263772581,NA,NA,NA,NA,NA,NA,NA,NA,NA,NA,NA,NA,NA,NA,NA,NA,1337.6773255814,50.7303664339578,NA,NA,NA,NA,NA,NA,1.0807786484134,0.471057658990753,0.080778648413397,"Maternity Leave Reform 1979",1979,"Familiy Policy",NA,"In 1979, the maternity leave coverage was extended  from 2 to 6 months. During these 6 months all entitled mothers received a maternal leave benefit of 750 Deutschmarks per month.",NA,NA,"Dustmann & Schönberg (2011)","https://academic.microsoft.com/paper/2075105139/"
"maternityLeave86",1176.71961264093,2714.95326736166,NA,-49.4846024753484,2229.46220930233,485.124419502394,-8.36593835047052,1992,0.433421682349782,NA,NA,NA,NA,NA,NA,NA,NA,NA,NA,NA,NA,NA,NA,NA,NA,1226.20421511628,8.73257690741442,NA,NA,NA,NA,NA,NA,1.2177615103919,0.52780424253487,0.2177615103919,"Maternity Leave Reform 1986",1986,"Familiy Policy",NA,"The 1986 maternity leave reform extended the period during which mothers had the right to return to their previous job and received maternity benefits from 6 to 10 months. At the same, the maternity benefit was reduced from 750 Deutschmarks to 600 Deutschmarks.",NA,NA,"Dustmann & Schönberg (2011)","https://academic.microsoft.com/paper/2075105139/"
"maternityLeave92",-395.876819802787,408.488021707945,NA,-395.876819802787,NA,405.554913252394,-66.9275068037641,1992,-0.969127119438095,NA,NA,NA,NA,NA,NA,NA,NA,NA,NA,NA,NA,NA,NA,NA,NA,NA,69.8606152593154,NA,NA,NA,NA,NA,NA,NA,NA,NA,"Maternity Leave Reform 1992",1992,"Familiy Policy",NA,"In contrast to the maternity leave reforms in 1979 and 1986, the maternity benefit amount as well as the period of entitlement remained unchanged. Instead, the mother's right to return to their previous job was prolonged to 36 months.",NA,NA,"Dustmann & Schönberg (2011)","https://academic.microsoft.com/paper/2075105139/"
"mentoringBalu",10651.347834421,1362.10643637453,NA,10651.347834421,1015.22842639594,-1879.64961783899,2226.52762781759,2013,7.81976176749539,NA,NA,NA,NA,NA,NA,NA,NA,NA,NA,NA,NA,NA,NA,NA,NA,NA,NA,NA,NA,NA,NA,NA,NA,1.34167483982891,10.4915776169046,0.341674839828914,"Mentoring Program Balu und Du",2011,"Education",10,"Elementary School students were assigned mentors who should encourage the acquisition of new ideas and skills.",NA,NA,"Falk et. al. (2020)","https://ideas.repec.org/p/ces/ceswps/_8382.html"
"negativeIncomeTax",2796.93799467531,4517.21703721472,2796.93799467531,NA,4584.67155828221,67.4545210674848,NA,2001,0.619172816278909,NA,NA,NA,NA,NA,NA,NA,NA,NA,NA,NA,NA,NA,NA,NA,NA,NA,NA,NA,NA,NA,NA,NA,NA,0.985286945812808,0.610062893081761,-0.014713054187192,"Negative Income Tax Experiment",2001,"Tax Reform",39.612,"Spermann & Strotmann (2006) evaluate the effects of what they call a negative income tax experiment. This is misleading because the experiment they are describing does not resemble what is typically considered a negative income tax as proposed by Milton Friedman. In the sense of Friedman, a negative income tax is a basic income that is gradually phased-out with increasing gross earnings. Instead, Spermann & Strotmann (2006) consider a experiment where long-term unemployed receive a  subsidy on top of their gross wage. The subsidy increases with the wage and can reach a maximum of up to 643 Deutschmark.",1278.225,NA,"Spermann & Strotmann (2006)","https://ideas.repec.org/p/iza/izadps/dp2067.html"
"oneEuroJobs",-242.922931917969,2550.78845410688,NA,-242.922931917969,2530.5,42.8687526914063,NA,NA,-0.0952344485983748,NA,NA,NA,NA,NA,NA,NA,NA,NA,NA,NA,NA,NA,NA,NA,NA,63.1572067982845,NA,NA,NA,NA,NA,NA,NA,1.00801756732143,-0.0959979972013315,0.00801756732143,"One Euro Jobs",2005,"Labor Market Policy",NA,"One Euro Jobs ""Ein Euro Jobs"" are jobs which are assigned to long term unemployed to help them reintegrate into the labor market. These jobs are meant to be unpayed. However, the participants receive a compenstation of at leat one euro per hour worked.",NA,NA,"Hohmeyer & Wolff (2010)","https://ideas.repec.org/p/iab/iabdpa/201021.html"
"parentalLeave2007",2606.13932602975,1721.68226156711,NA,NA,2606.13932602975,-884.457064462635,NA,2013,1.51371677818042,NA,NA,NA,NA,NA,NA,NA,NA,NA,NA,NA,NA,NA,NA,NA,NA,NA,NA,NA,NA,NA,NA,NA,NA,0.660625563787475,1,-0.339374436212525,"Parental Leave Reform 2007",2007,"Familiy Policy",29.76827,"In 2007, ""Elterngeld"" was introduced which replaced the fromer parental leave benefit ""Erziehungsgeld"". Under the new system, the amount of benefit is determined by the net income of the parent who is taking parental leave. For most parents the total benefit payment is higher even though the subsidy is payed for 12 months instead of previously 24 months.",2235.649,NA,"Frodermann et al. (2020);Kluve & Tamm (2013)","https://ideas.repec.org/p/iza/izadps/dp12935.html;https://ideas.repec.org/a/spr/jopoec/v26y2013i3p983-1005.html"
"placementService",813.332589000893,-289.16079175705,NA,813.332589000893,965.115796861044,-57.5144347326788,NA,2009,Inf,NA,NA,NA,NA,NA,NA,NA,NA,NA,NA,NA,NA,NA,NA,NA,NA,-1196.76215388542,NA,NA,NA,NA,NA,NA,NA,-0.29961253633763,0.842730573518937,-1.29961253633763,"Inhouse Placement Service",2009,"Labor Market Policy",50.1811,"Intensive Placement Services for unemployed can either be provided by the employment agency itself or it can be outsourced to a private contractor. The former is more expensive, but unemployed tend to show better labor market outcomes.",1543.018,NA,"Krug & Stephan (2017)","https://ideas.repec.org/p/iza/izadps/dp7403.html"
"practiceFirm",25159.9265603483,4690.75009484813,NA,25159.9265603483,9130.7371349096,-4439.98704006147,NA,1993,5.3637320367976,NA,NA,NA,NA,NA,NA,NA,NA,NA,NA,NA,NA,NA,NA,NA,NA,NA,NA,NA,NA,NA,NA,NA,NA,0.513731807798295,2.75551975580966,-0.486268192201705,"Practice Firm",1993,"Labor Market Policy",36,"Government sponsored training that simulates a job",1396,NA,"Lechner et. al. (2011)","https://ideas.repec.org/a/bla/jeurec/v9y2011i4p742-784.html"
"relocationAssistance",8442.77436089012,-146.294051868067,NA,8442.77436089012,1343.60730593607,-1489.90135780414,NA,2006,Inf,NA,NA,NA,NA,NA,NA,NA,NA,NA,NA,NA,NA,NA,NA,NA,NA,NA,NA,NA,NA,NA,NA,NA,NA,-0.108881554321518,6.28366214115527,-1.10888155432152,"Relocation Assistance",2006,"Labor Market Policy",37.71,"Unemployed who cannot find a new job locally are eligible for relocation assistence which either covers the immediate costs of moving or subsidizes a secondary flat for up to six months.",2624.958,NA,"Caliendo et al. (2011)","https://ideas.repec.org/a/eee/pubeco/v148y2017icp136-151.html"
"retraining",39833.9504854021,22154.0676432126,NA,39833.9504854021,29183.5883171071,-7029.52067389449,NA,1993,1.79804228852782,NA,NA,NA,NA,NA,NA,NA,NA,NA,NA,NA,NA,NA,NA,NA,NA,NA,NA,NA,NA,NA,NA,NA,NA,0.75912760975408,1.36494354472688,-0.24087239024592,"Retraining",1993,"Labor Market Policy",31,"Government sponsored training to obtain a new professional degree in a field other than the
profession currently held",1396,NA,"Lechner et. al. (2011)","https://ideas.repec.org/a/bla/jeurec/v9y2011i4p742-784.html"
"shortTraining",44696.1586473767,-1713.70483534251,NA,44696.1586473767,6173.85257301808,-7887.55740836059,NA,1993,Inf,NA,NA,NA,NA,NA,NA,NA,NA,NA,NA,NA,NA,NA,NA,NA,NA,NA,NA,NA,NA,NA,NA,NA,NA,-0.27757462865764,7.23958956239329,-1.27757462865764,"Short Training",1993,"Labor Market Policy",34.8,"Government sponsored Training Program lasting less less then 6 months",1396,NA,"Lechner et. al. (2011)","https://ideas.repec.org/a/bla/jeurec/v9y2011i4p742-784.html"
"speedLimitA3",7618583.60104271,4468919.42562871,NA,NA,0,NA,NA,2012,1.70479323421028,NA,NA,NA,3534073.64334712,NA,NA,1102432.16632338,NA,1347659.36299909,NA,-210509.909598374,NA,NA,NA,NA,NA,NA,NA,-5180129.54685891,7069601.57098087,3331769.97222799,1092605.76725026,NA,NA,Inf,Inf,Inf,"Speed Limit A3",2015,"Traffic Regulation",NA,"Potential Speed Limit of 130 kmph on German Autobahn A3",NA,NA,"Thiedig (2018)","https://ideas.repec.org/p/zbw/fubsbe/201817.html"
"speedLimitA61",8444375.45104883,9147776.23111509,NA,NA,0,NA,NA,2012,0.923106910106336,NA,NA,NA,3417089.29050678,NA,NA,2203085.2476828,NA,2693145.67360625,NA,-203541.64350488,NA,NA,NA,NA,NA,NA,NA,-13455926.8177137,14127854.1775348,6658172.20101372,2152273.5530381,NA,NA,Inf,Inf,Inf,"Speed Limit A61",2015,"Traffic Regulation",NA,"Potential Speed Limit of 130 kmph on German Autobahn A61",NA,NA,"Thiedig (2018)","https://ideas.repec.org/p/zbw/fubsbe/201817.html"
"sportsExpenditure",695.763263027269,-66.2446498254315,NA,695.763263027269,56.5371024734982,-122.78175229893,NA,2004,Inf,NA,NA,NA,NA,NA,NA,NA,NA,NA,NA,NA,NA,NA,NA,NA,NA,NA,NA,NA,NA,NA,NA,NA,NA,-1.17170224378732,12.3063127147948,-2.17170224378732,"Sports Expenditure",2004,"Health Program",37.63,"Increasing the public expenditure on sports facilities is found to have large effects on gross earnings of men.",2731,NA,"Pawlowski et al. (2019)","https://ideas.repec.org/p/diw/diwsop/diw_sp1040.html"
"startupGrant",32332.4449887627,5548.0303554239,NA,32332.4449887627,11253.7559416761,-5705.72558625224,NA,2009,5.82773397358102,NA,NA,NA,NA,NA,NA,NA,NA,NA,NA,NA,NA,NA,NA,NA,NA,NA,NA,NA,NA,NA,NA,NA,NA,0.492993662220613,2.87303591408319,-0.507006337779387,"Start Up Grant",2009,"Labor Market Policy",40.969,"The start up Grant is the follow up program to the  bridging allowance ""Überbrückungsgeld"" and start up subsidy ""Existenzgründungszuschuss"" which were replaced in 2006. This subsidy pays the individual unemloyment benefit for 6 months and an additional 300 euros for up to 15 months.",2047.962,NA,"Caliendo et. al. (2016)","https://ideas.repec.org/a/eee/eecrev/v86y2016icp87-108.html"
"startupSubsidy",22560.6112001281,12915.5431862384,NA,22560.6112001281,16896.8275156728,-3981.28432943436,NA,2003,1.74677989727653,NA,NA,NA,NA,NA,NA,NA,NA,NA,NA,NA,NA,NA,NA,NA,NA,NA,NA,NA,NA,NA,NA,NA,NA,0.764376814183521,1.33519805296005,-0.235623185816479,"Start Up Subsidy",2003,"Labor Market Policy",38.86,"The start up subsidy ""Existenzgründungszuschuss"" was a subsidy that was payed for 3 years to start up founders who received unemployment benefits before entering self-employment.",1459.378,NA,"Caliendo & Künn (2011)","https://ideas.repec.org/a/eee/pubeco/v95y2011i3p311-331.html"
"subsidizedJobOpportunities",6746.44233068672,25092.9811089954,NA,6746.44233068672,24257.5406032483,-1190.54864659177,NA,2005,0.268857745573651,NA,NA,NA,NA,NA,NA,NA,NA,NA,NA,NA,NA,NA,NA,NA,NA,-355.108140844674,NA,NA,NA,NA,NA,NA,NA,1.03444044552626,0.278117326114393,0.0344404455262555,"Subsidized Job Opportunities",2005,"Labor Market Policy",NA,"Similar to  Job Creation Schemes, Subsidized Job Opportunities ""Arbeitsgelegenheiten"" are jobs where the employer receives a subsidy. The focus of subsidized job opportunities lies on reintegration. The amount of subsidy payed to the employer is not fixed and the types of jobs that can be subsizied  is more broad.",NA,NA,"Hohmeyer & Wolff (2010)","https://ideas.repec.org/p/iab/iabdpa/201021.html"
"taxReform1990",1,-0.19240416827853,NA,NA,1,NA,NA,NA,Inf,NA,NA,NA,NA,NA,NA,NA,NA,NA,NA,NA,NA,NA,NA,NA,NA,NA,NA,NA,NA,NA,NA,-1.19240416827853,NA,-0.19240416827853,1,-1.19240416827853,"Top Tax Reform 1990",1990,"Top Tax Reform",NA,"In 1990 Germany reduced the top tax rate from 56% to 53%",NA,NA,"Atkinson & Piketty (2010);Gottfried & Schellhorn (2004)","https://ideas.repec.org/p/iaw/iawdip/15.html;https://ideas.repec.org/p/iaw/iawdip/15.html
"
"taxReform2000",1,0.352185678650037,NA,NA,1,NA,NA,NA,2.83941131233133,NA,NA,NA,NA,NA,NA,NA,NA,NA,NA,NA,NA,NA,NA,NA,NA,NA,NA,NA,NA,NA,NA,-0.647814321349963,NA,0.352185678650037,1,-0.647814321349963,"Top Tax Reform 2000",2000,"Top Tax Reform",NA,"Between 2001 and 2005 Germany reduced the top tax rate from 53% to 42%",NA,NA,"Doerrenberg et. al. (2017);Clementi and Gallegati (2005)","https://ideas.repec.org/a/eee/pubeco/v151y2017icp41-55.html;https://ideas.repec.org/p/arx/papers/physics-0504217.html
"
"trainingMeasures",6989.58036785837,-362.366497957485,NA,6989.58036785837,871.088861076345,-1233.45535903383,NA,2000,Inf,NA,NA,NA,NA,NA,NA,NA,NA,NA,NA,NA,NA,NA,NA,NA,NA,NA,NA,NA,NA,NA,NA,NA,NA,-0.415992574523032,8.02395792229718,-1.41599257452303,"Training Measures",2000,"Labor Market Policy",37,"Government sponsored short-term training programs ""Trainingsmaßnahmen"", which where introduced again in 1998 after being abolished in 1993",NA,NA,"Biewen et. al. (2014)","https://ideas.repec.org/a/ucp/jlabec/doi10.1086-677233.html"
"trainingVoucher",-8236.01976865998,4140.42379643218,NA,-8236.01976865998,2687.00854313925,1453.41525329294,NA,2003,-1.98917313144538,NA,NA,NA,NA,NA,NA,NA,NA,NA,NA,NA,NA,NA,NA,NA,NA,NA,NA,NA,NA,NA,NA,NA,NA,1.5409045896054,-3.06512600776393,0.540904589605399,"Training Voucher",2003,"Labor Market Policy",39.03,"Training Vouchers ""Bildungsgutscheine"" are awarded to unemployed to allow them to participate in training programs usually lasting between several months and 3 years.",1901.21,NA,"Doerr et. al. (2014);Huber et al. (2018)","https://ideas.repec.org/p/iza/izadps/dp8454.html;https://ideas.repec.org/p/cpr/ceprdp/10650.html"
"tuitionFees",-4185.34638411484,-1429.47681411908,NA,-2601.58701144634,-3593.0020478425,459.103590255236,-304.821031705815,2008,2.92788686236515,NA,NA,NA,NA,NA,NA,NA,NA,NA,NA,NA,NA,NA,NA,NA,NA,NA,NA,NA,NA,NA,NA,NA,NA,0.397850264231671,1.16486056183242,-0.602149735768329,"Tuition Fees",2008,"Education",21,"In 2006 and 2007 some German federal states introduced tuition fees of about 1000€ per year. All tuition fees in Germany have since been abolished again. Lower Saxony was the last state to scrap tuition fees in 2015.",NA,NA,"Gorgen & Schienle (2019);Bruckmeier & Wigger (2014)","https://ideas.repec.org/p/arx/papers/1909.08299.html;https://ideas.repec.org/a/eee/ecoedu/v41y2014icp14-23.html"
"unemploymentBenefits2002",1.4043583535109,2.01868930447084,NA,NA,1.21065375302663,NA,NA,2002,0.695678304928168,NA,NA,NA,NA,NA,NA,NA,NA,NA,NA,NA,NA,NA,NA,NA,NA,NA,NA,NA,NA,NA,NA,0.808035551444205,0.193704600484261,1.66743736549291,1.16,0.667437365492913,"Unemployment Benefits Age 45",2002,"Unemployment Insurance",45,"A discountinuity at the age of 45 in the German federal unemployment insurance system can be exploited to estimate the efficiency costs associated with expanding unemployment insurance for 45 year olds in Germany. Together with results from the theoretical literature on unemployment benefits, it is possible to calculate the implied MVPF.",1999.866,NA,"Caliendo et al. (2013);Schmieder & von Wachter (2016)","https://ideas.repec.org/a/wly/japmet/v28y2013i4p604-627.html;https://ideas.repec.org/a/anr/reveco/v8y2016p547-581.html"
"unemploymentBenefits2006",-1.32420091324201,-1.19397930655946,NA,NA,-1.14155251141553,NA,NA,2006,1.10906521240958,NA,NA,NA,NA,NA,NA,NA,NA,NA,NA,NA,NA,NA,NA,NA,NA,NA,NA,NA,NA,NA,NA,-0.0524267951439305,-0.182648401826484,1.04592587254608,1.16,0.0459258725460832,"Unemployment Benefits Hartz Reform",2006,"Unemployment Insurance",50.4924,"In 2006 the unemployment benefit duration was cut as part of the Hartz reforms. In contrast to the other studies which evaluate unemployment benefits, identification is not based on discontinuities in the benefit scheme but rather on the fact that not all age groups were affected by the Hartz reform. The MVPF is calculated for individuals who underwent medical rehabilitation treatments.",NA,NA,"Petrunyk & Pfeifer (2018);Schmieder et al. (2012);Schmieder & von Wachter (2016)","https://ideas.repec.org/p/iza/izadps/dp11300.html;https://ideas.repec.org/a/oup/qjecon/v127y2012i2p701-752.html;https://ideas.repec.org/a/anr/reveco/v8y2016p547-581.html"
"unemploymentBenefits42",1.61335187760779,1.67918457086901,NA,NA,1.39082058414465,NA,NA,1993,0.960794843876423,NA,NA,NA,NA,NA,NA,NA,NA,NA,NA,NA,NA,NA,NA,NA,NA,NA,NA,NA,NA,NA,NA,0.288363986724365,0.222531293463143,1.20733370645482,1.16,0.207333706454818,"Unemployment Benefits Age 42",1993,"Unemployment Insurance",42,"A discountinuity at the age of 42 in the German federal unemployment insurance system can be exploited to estimate the efficiency costs associated with expanding unemployment insurance for 42 year olds in Germany. Together with results from the theoretical literature on unemployment benefits, it is possible to calculate the implied MVPF.",1934.5,NA,"Schmieder et al. (2012);Schmieder & von Wachter (2016)","https://ideas.repec.org/a/oup/qjecon/v127y2012i2p701-752.html;https://ideas.repec.org/a/anr/reveco/v8y2016p547-581.html"
